<?xml version="1.0" encoding="UTF-8"?>
<dataroot xmlns:od="urn:schemas-microsoft-com:officedata" xmlns:xsi="http://www.w3.org/2001/XMLSchema-instance"  xsi:noNamespaceSchemaLocation="_Version.xsd" generated="2021-05-14T12:51:43">
<_Version>
<Version>1.0</Version>
</_Version>
<_Version>
<Version>2.7h</Version>
</_Version>
<_Version>
<Version>2.7i</Version>
</_Version>
<_Version>
<Version>2.7j</Version>
</_Version>
</dataroot>
